{
  "$schema": "https://json-schema.org/draft/2020-12/schema",
  "$id": "https://github.com/donovan-yohan/belayer/docs/artifact-schemas/world-state.schema.json",
  "title": "Belayer Story World State",
  "type": "object",
  "additionalProperties": false,
  "required": ["schema_version", "world", "timeline", "characters", "locations", "open_threads"],
  "properties": {
    "schema_version": {
      "const": "belayer-world-state/v1"
    },
    "world": {
      "type": "object",
      "additionalProperties": false,
      "required": ["name", "premise"],
      "properties": {
        "name": {
          "type": "string",
          "minLength": 1
        },
        "premise": {
          "type": "string",
          "minLength": 1
        },
        "tone": {
          "type": "string"
        }
      }
    },
    "timeline": {
      "type": "array",
      "items": {
        "$ref": "#/$defs/timeline_event"
      }
    },
    "characters": {
      "type": "array",
      "items": {
        "$ref": "#/$defs/entity_state"
      }
    },
    "locations": {
      "type": "array",
      "items": {
        "$ref": "#/$defs/entity_state"
      }
    },
    "open_threads": {
      "type": "array",
      "items": {
        "$ref": "#/$defs/thread"
      }
    },
    "updated_at": {
      "type": "string",
      "format": "date-time"
    }
  },
  "$defs": {
    "timeline_event": {
      "type": "object",
      "additionalProperties": false,
      "required": ["id", "summary"],
      "properties": {
        "id": {
          "type": "string",
          "minLength": 1
        },
        "summary": {
          "type": "string",
          "minLength": 1
        },
        "participants": {
          "type": "array",
          "items": {
            "type": "string",
            "minLength": 1
          },
          "default": []
        }
      }
    },
    "entity_state": {
      "type": "object",
      "additionalProperties": false,
      "required": ["id", "name", "state"],
      "properties": {
        "id": {
          "type": "string",
          "minLength": 1
        },
        "name": {
          "type": "string",
          "minLength": 1
        },
        "state": {
          "type": "string",
          "minLength": 1
        },
        "relationships": {
          "type": "array",
          "items": {
            "type": "string",
            "minLength": 1
          },
          "default": []
        }
      }
    },
    "thread": {
      "type": "object",
      "additionalProperties": false,
      "required": ["id", "summary", "status"],
      "properties": {
        "id": {
          "type": "string",
          "minLength": 1
        },
        "summary": {
          "type": "string",
          "minLength": 1
        },
        "status": {
          "enum": ["open", "resolved", "dormant"]
        }
      }
    }
  }
}
